{
  "id": "prop:vtxr:419",
  "type": "VariantTherapeuticResponseProposition",
  "predicate": "predictsSensitivityTo",
  "subjectVariant": {
    "type": "CategoricalVariant",
    "description": "Placeholder. Cat-VRS does not yet support sets of categorical variants. See the 'biomarkers' extension for biomarkers associated with this Proposition."
  },
  "conditionQualifier": {
    "id": "dis:ncit:C203675",
    "conceptType": "Disease",
    "name": "Esophagogastric Adenocarcinoma",
    "mappings": [
      {
        "relation": "broadMatch",
        "coding": {
          "id": "coding:oncotree:EGC",
          "code": "EGC",
          "name": "Esophagogastric Adenocarcinoma",
          "system": "https://oncotree.mskcc.org",
          "systemVersion": "oncotree_2025_10_03",
          "iris": [
            "https://oncotree.mskcc.org/?version=oncotree_2025_10_03&field=NAME&search=Esophagogastric+Adenocarcinoma+%28EGC%29"
          ]
        }
      }
    ],
    "extensions": [
      {
        "name": "solid_tumor",
        "value": true,
        "description": "Boolean value for if this tumor type is categorized as a solid tumor."
      }
    ],
    "primaryCoding": {
      "id": "coding:ncit:C203675",
      "code": "C203675",
      "name": "Gastroesophageal Junction Carcinoma",
      "system": "https://evsexplore.semantics.cancer.gov",
      "systemVersion": "26.08e",
      "iris": [
        "https://evsexplore.semantics.cancer.gov/evsexplore/concept/ncit/C203675"
      ]
    }
  },
  "objectTherapeutic": {
    "id": "tx:ncit:C1647",
    "conceptType": "Therapy",
    "name": "Trastuzumab",
    "mappings": [
      {
        "relation": "relatedMatch",
        "coding": {
          "id": "coding:rxcui:224905",
          "code": "224905",
          "name": "trastuzumab",
          "system": "RxNorm",
          "systemVersion": "20250602",
          "iris": [
            "https://mor.nlm.nih.gov/RxNav/search?searchBy=RXCUI&searchTerm=224905"
          ]
        }
      },
      {
        "relation": "relatedMatch",
        "coding": {
          "id": "coding:omop:1387104",
          "code": "1387104",
          "name": "trastuzumab",
          "system": "OMOP",
          "systemVersion": "v20250827",
          "iris": [
            "https://athena.ohdsi.org/search-terms/terms/1387104"
          ]
        }
      }
    ],
    "extensions": [
      {
        "name": "therapy_strategy",
        "value": [
          "HER2 inhibition"
        ],
        "description": "Associated therapeutic strategy or mechanism of action of the therapy."
      },
      {
        "name": "therapy_type",
        "value": "Targeted therapy",
        "description": "Type of cancer treatment from cancer.gov: https://www.cancer.gov/about-cancer/treatment/types"
      }
    ],
    "primaryCoding": {
      "id": "coding:ncit:C1647",
      "code": "C1647",
      "name": "Trastuzumab",
      "system": "https://evsexplore.semantics.cancer.gov",
      "systemVersion": "26.08e",
      "iris": [
        "https://evsexplore.semantics.cancer.gov/evsexplore/concept/ncit/C1647"
      ]
    }
  },
  "extensions": [
    {
      "name": "biomarkers",
      "value": [
        {
          "id": "bmkr.criterion:20",
          "present": true,
          "subject": {
            "id": "bmkr:20",
            "type": "CategoricalVariant",
            "name": "HER2-positive",
            "constraints": [],
            "extensions": [
              {
                "name": "biomarker_type",
                "value": "Protein expression"
              },
              {
                "name": "marker",
                "value": "Human epidermal growth factor receptor 2 (HER2)"
              },
              {
                "name": "unit",
                "value": "status"
              },
              {
                "name": "equality",
                "value": "="
              },
              {
                "name": "value",
                "value": "Positive"
              }
            ]
          }
        }
      ],
      "description": "The biomarkers associated with this Proposition, each with a `present` flag indicating if the biomarker is present (true) or absent (false). Multiple biomarkers are combined with implied AND logic."
    }
  ]
}