{
  "id": "prop:vtxr:587",
  "type": "VariantTherapeuticResponseProposition",
  "predicate": "predictsSensitivityTo",
  "subjectVariant": {
    "type": "CategoricalVariant",
    "description": "Placeholder. Cat-VRS does not yet support sets of categorical variants. See the 'biomarkers' extension for biomarkers associated with this Proposition."
  },
  "conditionQualifier": {
    "id": "dis:ncit:C7558",
    "conceptType": "Disease",
    "name": "Endometrial Carcinoma",
    "mappings": [
      {
        "relation": "exactMatch",
        "coding": {
          "id": "coding:oncotree:UCEC",
          "code": "UCEC",
          "name": "Endometrial Carcinoma",
          "system": "https://oncotree.mskcc.org",
          "systemVersion": "oncotree_2025_10_03",
          "iris": [
            "https://oncotree.mskcc.org/?version=oncotree_2025_10_03&field=NAME&search=Endometrial+Carcinoma+%28UCEC%29"
          ]
        }
      }
    ],
    "extensions": [
      {
        "name": "solid_tumor",
        "value": true,
        "description": "Boolean value for if this tumor type is categorized as a solid tumor."
      }
    ],
    "primaryCoding": {
      "id": "coding:ncit:C7558",
      "code": "C7558",
      "name": "Endometrial Carcinoma",
      "system": "https://evsexplore.semantics.cancer.gov",
      "systemVersion": "26.08e",
      "iris": [
        "https://evsexplore.semantics.cancer.gov/evsexplore/concept/ncit/C7558"
      ]
    }
  },
  "objectTherapeutic": {
    "id": "tx:ncit:C126799",
    "conceptType": "Therapy",
    "name": "Dostarlimab",
    "mappings": [
      {
        "relation": "relatedMatch",
        "coding": {
          "id": "coding:rxcui:2539967",
          "code": "2539967",
          "name": "dostarlimab",
          "system": "RxNorm",
          "systemVersion": "02-Mar-2026",
          "iris": [
            "https://mor.nlm.nih.gov/RxNav/search?searchBy=RXCUI&searchTerm=2539967"
          ]
        }
      },
      {
        "relation": "relatedMatch",
        "coding": {
          "id": "coding:omop:1536789",
          "code": "1536789",
          "name": "dostarlimab",
          "system": "OMOP",
          "systemVersion": "v20260227",
          "iris": [
            "https://athena.ohdsi.org/search-terms/terms/1536789"
          ]
        }
      },
      {
        "relation": "relatedMatch",
        "coding": {
          "id": "coding:omop:608113",
          "code": "608113",
          "name": "Dostarlimab",
          "system": "OMOP",
          "systemVersion": "v20260227",
          "iris": [
            "https://athena.ohdsi.org/search-terms/terms/608113"
          ]
        }
      }
    ],
    "extensions": [
      {
        "name": "therapy_strategy",
        "value": [
          "PD-1/PD-L1 inhibition"
        ],
        "description": "Associated therapeutic strategy or mechanism of action of the therapy."
      },
      {
        "name": "therapy_type",
        "value": "Immunotherapy",
        "description": "Type of cancer treatment from cancer.gov: https://www.cancer.gov/about-cancer/treatment/types"
      }
    ],
    "primaryCoding": {
      "id": "coding:ncit:C126799",
      "code": "C126799",
      "name": "Dostarlimab",
      "system": "https://evsexplore.semantics.cancer.gov",
      "systemVersion": "26.08e",
      "iris": [
        "https://evsexplore.semantics.cancer.gov/evsexplore/concept/ncit/C126799"
      ]
    }
  },
  "extensions": [
    {
      "name": "biomarkers",
      "value": [
        {
          "id": "bmkr.criterion:38",
          "present": true,
          "subject": {
            "id": "bmkr:38",
            "type": "CategoricalVariant",
            "name": "MSI-H",
            "constraints": [],
            "extensions": [
              {
                "name": "biomarker_type",
                "value": "Microsatellite stability"
              },
              {
                "name": "status",
                "value": "Microsatellite instability-high (MSI-H)"
              }
            ]
          }
        }
      ],
      "description": "The biomarkers associated with this Proposition, each with a `present` flag indicating if the biomarker is present (true) or absent (false). Multiple biomarkers are combined with implied AND logic."
    }
  ]
}