{
  "id": "prop:vtxr:330",
  "type": "VariantTherapeuticResponseProposition",
  "predicate": "predictsSensitivityTo",
  "subjectVariant": {
    "type": "CategoricalVariant",
    "description": "Placeholder. Cat-VRS does not yet support sets of categorical variants. See the 'biomarkers' extension for biomarkers associated with this Proposition."
  },
  "conditionQualifier": {
    "id": "dis:ncit:C4025",
    "conceptType": "Disease",
    "name": "Esophageal Adenocarcinoma",
    "mappings": [
      {
        "relation": "exactMatch",
        "coding": {
          "id": "coding:oncotree:ESCA",
          "code": "ESCA",
          "name": "Esophageal Adenocarcinoma",
          "system": "https://oncotree.mskcc.org",
          "systemVersion": "oncotree_2025_10_03",
          "iris": [
            "https://oncotree.mskcc.org/?version=oncotree_2025_10_03&field=NAME&search=Esophageal+Adenocarcinoma+%28ESCA%29"
          ]
        }
      }
    ],
    "extensions": [
      {
        "name": "solid_tumor",
        "value": true,
        "description": "Boolean value for if this tumor type is categorized as a solid tumor."
      }
    ],
    "primaryCoding": {
      "id": "coding:ncit:C4025",
      "code": "C4025",
      "name": "Esophageal Adenocarcinoma",
      "system": "https://evsexplore.semantics.cancer.gov",
      "systemVersion": "26.08e",
      "iris": [
        "https://evsexplore.semantics.cancer.gov/evsexplore/concept/ncit/C4025"
      ]
    }
  },
  "objectTherapeutic": {
    "id": "tx:ncit:C106432",
    "conceptType": "Therapy",
    "name": "Pembrolizumab",
    "mappings": [
      {
        "relation": "relatedMatch",
        "coding": {
          "id": "coding:rxcui:1547545",
          "code": "1547545",
          "name": "pembrolizumab",
          "system": "RxNorm",
          "systemVersion": "02-Mar-2026",
          "iris": [
            "https://mor.nlm.nih.gov/RxNav/search?searchBy=RXCUI&searchTerm=1547545"
          ]
        }
      },
      {
        "relation": "relatedMatch",
        "coding": {
          "id": "coding:omop:45775965",
          "code": "45775965",
          "name": "pembrolizumab",
          "system": "OMOP",
          "systemVersion": "v20260227",
          "iris": [
            "https://athena.ohdsi.org/search-terms/terms/45775965"
          ]
        }
      },
      {
        "relation": "relatedMatch",
        "coding": {
          "id": "coding:omop:37396350",
          "code": "37396350",
          "name": "Pembrolizumab",
          "system": "OMOP",
          "systemVersion": "v20260227",
          "iris": [
            "https://athena.ohdsi.org/search-terms/terms/37396350"
          ]
        }
      }
    ],
    "extensions": [
      {
        "name": "therapy_strategy",
        "value": [
          "PD-1/PD-L1 inhibition"
        ],
        "description": "Associated therapeutic strategy or mechanism of action of the therapy."
      },
      {
        "name": "therapy_type",
        "value": "Immunotherapy",
        "description": "Type of cancer treatment from cancer.gov: https://www.cancer.gov/about-cancer/treatment/types"
      }
    ],
    "primaryCoding": {
      "id": "coding:ncit:C106432",
      "code": "C106432",
      "name": "Pembrolizumab",
      "system": "https://evsexplore.semantics.cancer.gov",
      "systemVersion": "26.08e",
      "iris": [
        "https://evsexplore.semantics.cancer.gov/evsexplore/concept/ncit/C106432"
      ]
    }
  },
  "extensions": [
    {
      "name": "biomarkers",
      "value": [
        {
          "id": "bmkr.criterion:41",
          "present": true,
          "subject": {
            "id": "bmkr:41",
            "type": "CategoricalVariant",
            "name": "PD-L1 (CPS) >= 10",
            "constraints": [],
            "extensions": [
              {
                "name": "biomarker_type",
                "value": "Protein expression"
              },
              {
                "name": "marker",
                "value": "PD-L1"
              },
              {
                "name": "unit",
                "value": "Combined Positive Score (CPS)"
              },
              {
                "name": "equality",
                "value": ">="
              },
              {
                "name": "value",
                "value": 10
              }
            ]
          }
        }
      ],
      "description": "The biomarkers associated with this Proposition, each with a `present` flag indicating if the biomarker is present (true) or absent (false). Multiple biomarkers are combined with implied AND logic."
    }
  ]
}